,주소,제목,내용
0,https://shiningyouandme.tistory.com/48,태그,"                                      윤이나영                      메뉴                                                        윤이나영                                   분류 전체보기 (52)  인공지능 (4)  빅데이터 잡아라 (10)  ADsP (0)  ADP (9)  데이터분석 스터디 (1)  python 전문가로 (9)  PyQt (0)  Django (8)  Python (1)  금융 (4)  포트폴리오 모델 (4)  경제 (0)  내돈내산 찐찐찐 후기 (22)  호텔, 광고 없는 진짜 리뷰! (13)  카페는 분위기지 (1)  메모해두고 싶은 맛집 (6)  여자가 가고싶은 데이트 코스 (0)  쇼핑 하울 언박싱 찐추천 (2)  IT (0) 홈태그RSS 피드로그인로그아웃글쓰기관리                                            윤이나영                          컨텐츠 검색태그 호캉스 자소서질문 ADP 포트폴리오 가성비호텔 ADP실기 모의고사 인공지능대학원 호텔 Python 포트폴리오 비주얼라이저 데이터분석 데이터분석전문가 Efficient frontier Django 파이썬 데이터에듀 포트폴리오모델 포트폴리오비주얼라이저 Portfolio Visualizer최근글 [포트폴리오 비주얼라이저(PORTFOLIO VISUAL⋯ [포트폴리오 비주얼라이저(PORTFOLIO VISUAL⋯ [포트폴리오 비주얼라이저(PORTFOLIO VISUAL⋯ [포트폴리오 비주얼라이저(PORTFOLIO VISUAL⋯댓글안녕하세요, 감사드립니다.  그런데 단계적 선택법 코드 첫 번째 줄의 '⋯감사드립니다^^const movevixlibor = document.getElement⋯hidden layer의 node 개수를 말하는건가요?? 아니면 hidd⋯공지사항아카이브2022/092022/082022/062022/052022/04직장인 인공지능 대학원 합격 후기 2탄(면접질문 및 준비과정)2022. 2. 2. 00:45ㆍ인공지능     (adsbygoogle = window.adsbygoogle || []).push({});반응형(adsbygoogle = window.adsbygoogle || []).push({});안녕하세요 :) 이번에는 직장인 인공지능 대학원 합격후기 면접편을 공유드릴려고해요.자기소개서 합격 후에 인터넷에 면접 질문이랑 후기를 찾아봤는데, 직장인 대핵원이기 때문에 질문 난이도가 높지 않다고 하더라구요... 공통적으로 아래와 같은 질문들이 인터넷에서 쉽게 볼 수 있는 면접 질문 리스트입니다.   1. 자기소개2. 현재 하고 있는 업무 소개3. 업무와 대학원 진학의 연관성4. 다른 지원자와 차별되는 나만의 장점5. 연구하고 싶은 분야 6. 졸업 후 계획 7. 자기소개서 기반 질문 실제 인공지능 대학원 면접에서 나온 질문은? 1. 자기소개 2. 현재 하고 있는 업무 4. 다른 지원자와 차별되는 나만의 장점 이렇게 나왔습니다. 1. 자기소개와 2. 현재 하고 있는 업누는 3개의 대학교 모두 공통적으로 나왔고, 4. 다른지원자와 차별되는 나만의 장점은 1번 나왔습니다. 그럼 제가 기억은 잘 안나지만 직접 면접 나온 질문들을 공유드릴게요.5명~6명이 1조로 면접을 봅니다. - K대(대면):   1) 자기소개 및 업무   2) 전공질문시작: 딥러닝의 문제점과 해결방법은?   3) PCA란 무엇인가   4) Linear regression이 무엇인지 설명하시오   5) 그밖에 자기소개 관련 심층 질문들.. - Y대(비대면):  1) 자기소개 (30초)  2) 인공지능관련 질문 13개중 1개 선택해서 대답(1분 30초)  ※ 질문(기억이 잘 안나지만 적어볼게요..): attention 관련/ rnn, lstm, gru모델 설명/ regulation 종류와 쓰는이유/       비정형분석 알고리즘/ 기계학습과 딥러닝의 차이/ self supervise란- S대(비대면):  1) 자기소개  2) 자기소개 심층 질문(이어서 전공 관련 질문으로 자연스럽게 넘어가서 질문하십니다.)저는 사실 K대가 가장 먼저 면접을 보는 일정이여서 가벼운 마음으로 갔었는데, 정말 깜짝놀랬어요...전공 관련 질문이 있었고, 난이도가 꽤 있었습니다ㅜㅜ..그래서 경각심을 가지고 다음 면접을 준비했습니다.. 그때부터 부랴부랴 인공지능 관련 공부를 했던 거 같아요.. 시간이 없어서 인터넷에서 인공지능 관련 질문(직장인 대학원X, 일반대학원생O)을 수집해서 공부했습니다. 공부했던 면접 예상 질문들을 공유드릴게요.1) AI, ML, DL의 차이점2) 지도학습, 비지도학습, 강화학습 정의 및 종류3) eigenvector, eigenvalue란4) pca 개념설명5) singular value decompositon이란6) precision, recall, F1의 무엇이고 왜 쓰는가7) MLE와 MAP의 가장 큰 차이점은?8) 베이즈 정리란9) SVM이란10) Kernel Trick이란11) FC Layer란12) 활성함수 종류란 사용하는 이유13) Backpropagation(역전파)이란 14) 경사하강법이란15) convolution layer란:16) Batch normalization이란17) RNN/ LSTM/ ATTENTION이란 아래는 제가 위 예상 면접 질문에 대한 답변을 적은 거에요. (맞는지 틀린지 모릅니다!!ㅠㅠ 참고만 해주세요.)  모두모두 좋은 결과 있으시길 바랍니다.긴글읽어주셔서 감사합니다. ▼ 인공지능 대학원 자소서 준비과정 공유 https://shiningyouandme.tistory.com/47      (adsbygoogle = window.adsbygoogle || []).push({});    if(window.ObserveAdsenseUnfilledState !== undefined){ ObserveAdsenseUnfilledState(); }window.ReactionButtonType = 'reaction';window.ReactionApiUrl = '//shiningyouandme.tistory.com/reaction';window.ReactionReqBody = {    entryId: 48}공유하기게시글 관리윤이나영저작자표시 '인공지능' 카테고리의 다른 글딥러닝 Hidden Layer 개수 정해보기: Deep Learning With Only Numpy(패키지 없이 코딩하기)  (1)2022.05.05Neural Network Gradient Descent With Only Numpy(패키지 없이 코딩하기)  (0)2022.04.23직장인 인공지능 대학원 합격 후기 1탄(자소서 항목 및 준비과정)  (1)2022.01.31     (adsbygoogle = window.adsbygoogle || []).push({});TAG대학원면접, 대학원자소서, 면접공유, 면접질문, 인공지능대학원, 자소서공유, 자소서질문, 합격후기관련글딥러닝 Hidden Layer 개수 정해보기: Deep Learning With Only Numpy(패키지 없이 코딩하기)2022.05.05Neural Network Gradient Descent With Only Numpy(패키지 없이 코딩하기)2022.04.23직장인 인공지능 대학원 합격 후기 1탄(자소서 항목 및 준비과정)2022.01.31댓글 2+ 이전 댓글 더보기    setInitialEntryComments(48, 1723699319) 비공개댓글 남기기loadedComments[48]=true;findFragmentAndHighlight(48);삶이 더 윤이나게Happy Life티스토리툴바hljs.initHighlightingOnLoad();window.roosevelt_params_queue = window.roosevelt_params_queue || [{channel_id: 'dk', channel_label: '{tistory}'}]window.tiara = {""svcDomain"":""user.tistory.com"",""section"":""글뷰"",""trackPage"":""글뷰_보기"",""page"":""글뷰"",""key"":""3605721-48"",""customProps"":{""userId"":""0"",""blogId"":""3605721"",""entryId"":""48"",""role"":""guest"",""trackPage"":""글뷰_보기"",""filterTarget"":false},""entry"":{""entryId"":""48"",""entryTitle"":""직장인 인공지능 대학원 합격 후기 2탄(면접질문 및 준비과정)"",""entryType"":""POST"",""categoryName"":""인공지능"",""categoryId"":""951204"",""serviceCategoryName"":""과학"",""serviceCategoryId"":404,""author"":""4179932"",""authorNickname"":""비단라"",""blogNmae"":""윤이나영"",""image"":""kage@bue6hn/btrr3n81qTb/S7YWff07EdL4TY8HJ2aKM1"",""plink"":""/48"",""tags"":[""대학원면접"",""대학원자소서"",""면접공유"",""면접질문"",""인공지능대학원"",""자소서공유"",""자소서질문"",""합격후기""]},""kakaoAppKey"":""3e6ddd834b023f24221217e370daed18"",""appUserId"":""null""}"
1,https://yaeyang0629.tistory.com/entry/%EC%86%94%EC%A7%81%ED%95%9C-%EC%9D%B8%EA%B3%B5%EC%A7%80%EB%8A%A5-%EB%8C%80%ED%95%99%EC%9B%90-%EC%A4%80%EB%B9%84-%EB%B0%8F-%ED%95%A9%EA%B2%A9-%ED%9B%84%EA%B8%B0,태그,"활동솔직한 인공지능 대학원 준비 및 합격 후기by 방구석 데이터사이언티스트2023. 1. 29.     (adsbygoogle = window.adsbygoogle || []).push({});    if(window.ObserveAdsenseUnfilledState !== undefined){ ObserveAdsenseUnfilledState(); }728x90반응형(adsbygoogle = window.adsbygoogle || []).push({});인공지능 대학원을 준비하는 분들을 위해 후기를 남겨봅니다. 저는 한양대, 성균관대, 연세대를 지원했고 3곳 모두 최종합격 했습니다. 1. 준비 및 스펙사실 저는 대학원에 대한 생각이 처음부터 있었던 것은 아니었고 좀 뒤 늦게 대학원 진학을 결심했습니다.그래서 대학원 입시를 위한 기초 수학(선형대수, 확*통), 프로그래밍, 인공지능 기초 개념 등을 차근차근 공부하기 시작했습니다. 그리고 꾸준히 내가 어떤 연구를 할지도 생각하면서, 자기소개서와 연구계획서도 미리미리 작성하였습니다.  선형대수, 확*통 같은 수학 과목들은 현펜하임, 쑤튜브 등 유튜브에 잘 정리된 영상을 보면서 공부했습니다. 프로그래밍은 코테준비하듯이 자료구조나 알고리즘에 대한 개념을 익히면서 알고리즘 문제를 조금씩 풀어봤습니다.마지막으로 인공지능은 사실 분야가 너무 넓기에 다 공부할 수 있는 것은 아니라고 생각했고, 그냥 내가 연구하고자하는 분야에 기초는 확실히 알면서, 일반적인 기술면접에 나온다는 질문들의 개념들을 차근차근 되집어 봤습니다.  본인 합격 스펙Y대 분캠 3.8/4.5데이터 관련 자격증 2개 경진대회&공모전 수상 5회(다른 게시글에 후기 참고)벤처기업? 스타트업?의 데이터 사이언티스트 직무 정규직 경력(3개월ㅎㅎ)  2. 컨택저는 선컨택 없이 지원했습니다.사실 컨택을 안하고 싶어서 안한 것은 아니었고, 가고싶은 연구실을 추려서 메일을 보내보면 전부 ""자리가 없다""는 대답이었습니다. 그래서 저는 합격 이후 컨택을 시도했고, 합격이전에 보낸 연구실에도 메일을 보냈지만 대답은 똑같했습니다.  이건 그냥 서류상으로 보이는 제 능력이 부족해 보일 수 도 있고, 진짜 자리가 없을 수도 있는 건데..컨택은 그냥 최대한 빨리 해보시길 권장드립니다.     3. 입시입시 일정순으로 성균관대 -> 한양대 -> 연세대 이렇게 입시를 진행했습니다. 성균관대 입시 일정이 가장 빠르다보니, 자기소개서&연구계획서도 성균관대를 베이스로 작성하고 거기서 학교에 맞춰 조금씩 수정했습니다.  성균관대는 서류에서 많이 걸러지는 것 같았습니다. 성대 인공지능대학원은 특이사항으로 ""면접 대상자만 면접 가능""이라는 문구와 함께 1차적으로 면접 대상자를 알려줬습니다. 그때 궁금해서 인원을 대충 확인해보니..50-60명정도 되었던 것 같습니다. 그리고 면접에서는 자신의 학부에 대한 질문과 인공지능에 대한 질문 등을 진행했습니다. 인공지능 관련 질문에서는 NLP 관련 질문도 있었고 Vision 관련 질문도 있었습니다.  한양대의 경우, 꽤 많은 인원이 면접대기장소에 있었고 다대다 면접으로 진행했습니다. 면접 관련 질문들은 유튜브에서 많이 돌아다니는 것 같아 자세히 얘기하지는 않겠습니다. 인공지능을 어느정도 해보셨다면 충분히 대답할 수 있는 질문들입니다.  연세대의 경우, 전날 월드컵 포르투칼전이었는데ㅎㅎ, 솔직히 이거 안본 사람 없을 듯 16강 진출에 설레는 마음으로 오전에는 기초시험을 치루고 오후에 면접을 봤습니다. 기초시험은 영어로 나오고 선대*확통, 프로그래밍, 인공지능에 대한 문제들로 구성되며 생각보다 어려워서 당황했습니다. 제가 느끼기에는 선대*확통, 프로그래밍가 오히려 괜찮았고 인공지능에서 생소한 개념이 있어 인공지능 문제를 좀 틀렸을 거라 생각합니다. 영어로 나오는 것에 대해서는 걱정 안해도 되는 부분입니다. 어렵지 않은 짫은 문장의 영어입니다.  4. 합격 이후현재 저는 연세대학교 인공지능학과로 진학을 결심했습니다. 앞으로 2년 좋은 일만 있으면서 좋은 후기를 많이 쓸 수 있기를 바라면서..지금까지 대학원 준비 및 합격 후기였습니다. 감사합니다.  728x90반응형(adsbygoogle = window.adsbygoogle || []).push({});window.ReactionButtonType = 'reaction';window.ReactionApiUrl = '//yaeyang0629.tistory.com/reaction';window.ReactionReqBody = {    entryId: 40}공유하기게시글 관리DATA NOTE저작자표시 '활동' 카테고리의 다른 글솔직한 연세대학교 인공지능 대학원 관련 정보  (2)2023.07.07솔직한 인공지능 국비 교육에 대한 생각  (0)2023.02.07데이콘 : 한국어 문장 관계 분류 경진대회 후기 (feat. 성능 향상 방법)  (0)2022.03.08[데이터 사이언티스트][자소서] 카카오뱅크 서류합격 후기  (2)2022.02.09[서평][리뷰] 솔직한 Do it! BERT와 GPT로 배우는 자연어 처리 서평  (0)2022.02.09태그인공지능 대학원, 인공지능 대학원 준비, 인공지능 대학원 후기관련글솔직한 연세대학교 인공지능 대학원 관련 정보솔직한 인공지능 국비 교육에 대한 생각데이콘 : 한국어 문장 관계 분류 경진대회 후기 (feat. 성능 향상 방법)[데이터 사이언티스트][자소서] 카카오뱅크 서류합격 후기댓글40    setInitialEntryComments(40, 1723699319)비밀글등록loadedComments[40]=true;findFragmentAndHighlight(40);"
2,https://jrc-park.tistory.com/259,정답 ,"에세이AI 대학원 면접 준비 - 전공 질문 리스트 Rudi2021. 6. 14. 19:43본 질문들은 필자가 KAIST AI 대학원 면접을 준비하면서 만든 질문 리스트입니다. 머신러닝, 확률, 선형대수학과 관련된 질문들로 모두 답해야 하는 것은 아니며,알고있는 지식의 정도를 확인하는데 도움이 될 것 같습니다.Statistic / Probability 🧐 Central Limit Theorem 이란 무엇인가?  🧐 Central Limit Theorem은 어디에 쓸 수 있는가?🧐 큰수의 법칙이란?🧐 확률이랑 통계랑 다른 점은?🧐 Marginal Distribution이란 무엇인가?🧐 Conditional Distribution이란 무엇인가?  🧐 Bias란 무엇인가?  [Answer Post]🧐 Biased/Unbiased estimation의 차이는?  [Answer Post]🧐 Bias, Variance, MSE란? 그리고 그들의 관계는 무엇인가?🧐 Sample Variance란 무엇인가?🧐 Variance를 구할 때, N대신에 N-1로 나눠주는 이유는 무엇인가?🧐 Gaussian Distribution에서 MLE와 Sample Variance 중에 어떤 걸 사용해야 하는가?🧐 Unbiased Estimation은 무조건 좋은가?🧐 Unbiaed Estimation의 장점은 무엇인가?  🧐 Binomial, Bernoulli, Multinomial, Multinoulli 란 무엇인가?🧐 Beta Distribution과 Dirichlet Distribution이란 무엇인가?🧐 Gamma Distribution은 어디에 쓰이는가?🧐 Possion distribution은 어디에 쓰이는가?🧐 Bias and Varaince Trade-Off 란 무엇인가? [Answer Post]🧐 Conjugate Prior란?🧐 Confidence Interval이란 무엇인가?🧐 covariance/correlation 이란 무엇인가?🧐 Total variation 이란 무엇인가?🧐 Explained variation 이란 무엇인가?🧐 Uexplained variation 이란 무엇인가🧐 Coefficient of determination 이란? (결정계수)🧐 Total variation distance이란 무엇인가?🧐 P-value란 무엇인가?🧐 likelihood-ratio test 이란 무엇인가?Machine Learning 🧐 Frequentist 와 Bayesian의 차이는 무엇인가?🧐 Frequentist 와 Bayesian의 장점은 무엇인가?🧐 차원의 저주란?🧐 Train, Valid, Test를 나누는 이유는 무엇인가?🧐 Cross Validation이란?🧐 (Super-, Unsuper-, Semi-Super) vised learning이란 무엇인가?Supervised Learning / Unsupervised Learning / Semi-Supervised Learning🧐 Decision Theory란?🧐 Receiver Operating Characteristic Curve란 무엇인가?🧐 Precision Recall에 대해서 설명해보라🧐 Precision Recall Curve란 무엇인가?🧐 Type 1 Error 와 Type 2 Error는?🧐 Entropy란 무엇인가?🧐 KL-Divergence란 무엇인가?🧐 Mutual Information이란 무엇인가?🧐 Cross-Entropy란 무엇인가?🧐 Cross-Entropy loss 란 무엇인가?🧐 Generative Model이란 무엇인가?🧐 Discriminative Model이란 무엇인가?🧐 Discrinator function이란 무엇인가?🧐 Overfitting 이란? [Answer Post]🧐 Underfitting이란? [Answer Post]🧐 Overfitting과 Underfitting은 어떤 문제가 있는가?🧐 Overfitting과 Underfitting을 해결하는 방법은? [Answer Post]🧐 Regularization이란?Ridge / Lasso🧐 Activation function이란 무엇인가?3가지 Activation function type이 있다.Ridge activation Function / Radial activation Function  / Folding activation Function🧐 CNN에 대해서 설명해보라🧐 RNN에 대해서 설명해보라🧐 Netwon's method란 무엇인가?🧐 Gradient Descent란 무엇인가?🧐 Stochastic Gradient Descent란 무엇인가?🧐 Local optimum으로 빠지는데 성능이 좋은 이유는 무엇인가?🧐 Internal Covariance Shift 란 무엇인가?🧐 Batch Normalization은 무엇이고 왜 하는가?🧐 Backpropagation이란 무엇인가?🧐 Optimizer의 종류와 차이에 대해서 아는가?🧐 Ensemble이란?🧐 Stacking Ensemble이란?🧐 Bagging이란?🧐 Bootstrapping이란?🧐 Boosting이란?🧐 Bagging 과 Boosting의 차이는?🧐 AdaBoost / Logit Boost / Gradient Boost🧐 Support Vector Machine이란 무엇인가?🧐 Margin을 최대화하면 어떤 장점이 있는가?Linear Algebra 🧐 Linearly Independent란?🧐 Basis와 Dimension이란 무엇인가?🧐 Null space란 무엇인가?🧐 Symmetric Matrix란?🧐 Possitive-definite란?🧐 Rank 란 무엇인가?🧐 Determinant가 의미하는 바는 무엇인가?🧐 Eigen Vector는 무엇인가?🧐 Eigen Vector는 왜 중요한가?🧐 Eigen Value란?🧐 SVD란 무엇인가?→ 중요한 이유는?🧐 Jacobian Matrix란 무엇인가?단순히 개념을 물어보는 질문도 있고, 조금더 Advanced된 질문들도 있습니다. 정답을 암기하는 것보다 각 개념들이 지니는 의미를 이해하고 정답을 찾아가면서 공부하시는 것을 추천드립니다. 🤗🤗정답 [1] Machine Learning에서 Bias란 무엇인가?[2] Biased, Unbiased Estimator란 무엇인가?[3] Bias-Variance Trade-off[4] Machine Learning에서 Overfitting과 Underfitting은 뭘까..? [5] Overfitting을 해결하는 방법 3가지        (adsbygoogle = window.adsbygoogle || []).push({});    if(window.ObserveAdsenseUnfilledState !== undefined){ ObserveAdsenseUnfilledState(); }window.ReactionButtonType = 'reaction';window.ReactionApiUrl = '//jrc-park.tistory.com/reaction';window.ReactionReqBody = {    entryId: 259}공유하기게시글 관리Rudi 저작자표시 비영리 동일조건 '에세이' 카테고리의 다른 글대학원 컨텍 메일 필독 사항  (2)2022.01.092021년 생존한 대학원생 경험담 - 1  (2)2021.12.21빠른 속도로 데이터를 처리하기 위한 두 종류 FPGA vs GPU  (0)2020.06.11넷플릭스 데이터 사이언티스트 인터뷰  (0)2020.02.28[IT상식] Microsoft의 블록체인 서비스를 활용하는 스타벅스  (0)2020.02.16이전 댓글 더보기    setInitialEntryComments(259, 1723695914)Secret댓글달기🙂loadedComments[259]=true;findFragmentAndHighlight(259);"
