,주소,제목,내용
0,https://day-to-day.tistory.com/52,신입 머신러닝 엔지니어 / AI 리서처 면접 후기,"본문 바로가기Day to_day카테고리검색하기검색하기블로그 내 검색Day to_daym_inglet Tech blog (66)  Python (4)  SQL (7)  Project (12)  Machine Learning (16)  머신러닝 기초 (6)  지도 학습 (8)  비지도 학습 (0)  Deep Learning (9)  영상처리 (2)  논문 리뷰 (6)  In my mind (5)  책빵! (3) GuestbookNoticeRecent PostsLoRA(Low-Rank Adaptation)를 ⋯Docker 최소한의 개념과 기본 사용법 알아보기AutoRAG 실험해보기 (+ 사용 후기)ResNet 핵심만 빠르게!Recent Comments제 블로그를 참고해주셔서 감사합니다!!공부 잘 하고 갑니당 !포스팅 잘 보고 갑니다! 좋은 정보 감사해요 ㅎㅎ항상 잘 보고 있습니다 좋은 하루 되세요 :)Linkminglet githubprofile«   2024/08   »일월화수목금토    12345678910111213141516171819202122232425262728293031TagsNULLIF백엔드데이터 전처리sorted감정은 습관이다강화학습빠르게 실패하기평가 지표지도학습재현율정밀도데이터 프로젝트DecisionTreeLAGSQLlayer normalizationBatch Normalization오차 행렬beautifulsouprecallifnullnvl2five lines challenge웹서비스 기획비지도학습NVLNormalization데이터 분석CASE WHEN결정트리moreArchives2024/08 (2)2024/07 (1)2024/04 (3)2024/03 (4)2024/02 (8)Today17Total13,587닫기관리 메뉴글쓰기방명록RSS관리Day to_day신입 머신러닝 엔지니어 / AI 리서처 면접 후기 본문In my mind신입 머신러닝 엔지니어 / AI 리서처 면접 후기m_inglet                           2024. 2. 3. 17:23728x90반응형(adsbygoogle = window.adsbygoogle || []).push({}); '머신러닝 공부하는 학생의 구직'을 이미지 생성 AI에 요청한 이미지 첫 구직활동의 후기를 기록해 두고 혹시나 나의 경험이 도움이 되는 사람이 있을까 하고 남겨두려고 한다. 일단 나의 상황을 설명하자면 인턴 계약이 끝나고 한 달 정도의 집 계약이 남은 상태였다. 나는 타 지역에서 서울에 올라왔기 때문에 남은 한 달 동안 열심히 구직활동을 해서 일단 취업을 하자는 목표가 컸다. 왜냐면.. 서울에서 생활을 유지해야 했기 때문이다. 특히 타 지역에서 서울로 면접 한번 보기 위해서는 그 하루의 차비, 식비를 계산하면 한 달에 면접 5번만 봐도 서울에서 생활하는 게 더 유리했다.  아무튼 완벽하게 준비된 건 없었다. 이력서를 부랴부랴 완성시키고, 포트폴리오 PPT는 없었다. (마음 급하게 구직을 했는데 이런 상태에서는 지혜로운 선택을 할 수 없어서 사실 추천하진 않음) 하지만 일단은 시작해버린걸. 과거의 나를 탓하기엔 너무 늦었다.  내 면접 후기를 결론부터 말하자면면접은 많이 보면 볼 수록 좋다. 계속해서 실패하더라도 그 실패로 인해서 내 지금의 위치를 깨닫게 된다.내가 가진 구멍이 무엇인지 보이고 그 구멍을 채우기 위해 자연스레 노력하게 될 것이다. 별로 원하지 않는 기업이더라도 나라는 제품이 시장에서 어떻게 팔리는지 고객의 피드백은 어떤지를 듣고 싶다면 안 가는 것보다 가는 게 훨씬 얻는 게 많다.  실제로 나는 직전에 인턴을 했던 경험이 있는데 AI 직무가 아니었는데도 불구하고 그것에 대해서 어떤 업무를 했는지에 대한 질문이 항상 있었다. (코딩을 하는 직군이긴 했음) 그래서 나는 어필할 수 없는 부분이라 생각했는데 면접관의 입장에서는 어필이 되는 거구나 하고 깨달았다.  결과는..?일단 한 달 반의 여정동안 내가 받은 결과는 다음과 같다. 기간: 2023.05.31 - 2023.7.17서류 제출: 약 50개면접: 9개최종 합격: 2개최종 탈락: 5개무응답: 2건 과제 전형서류 합격 후 이후에 진행했던 과정들은 회사마다 다 달랐다. 경험해 본 것을 정리하자면 다음과 같다. 1. 과제 전형 (실제 프로젝트를 진행하는 전형. 약 일주일 소요)2. 논문 리뷰3. 손코딩4. 코딩테스트5. 질문에 대한 해결 방법 제출 회사마다 원하는 인재에 따라 다르게 검증을 하는데 확실히 과제 전형이 전체 면접 프로세스 과정이 가장 오래 걸리긴 했다. 나머지 사전 과제들에 대해선 크게 어려움을 느끼진 않았다. 하지만 여기서 느낀 게 한 가지 있었다.  한 회사에서 내가 AI 리서처가 되고 싶은지, AI 엔지니어가 되고 싶은지에 대해 확실히 하는 게 좋을 것 같다는 피드백이 있었다. 정말 면접에서 느끼는 부끄러움은 다시는 느끼고 싶지 않지만 지나고 나면 다 값진 피드백들이다. 물론 둘 다 리서처 능력과 코딩 능력 모두 요구하는 직무이다. 그렇지만 내가 가진 강점이 어느 쪽에 더 가까운지를 생각해봐야 한다. 실제 구현을 빠르게 해 보고 서비스에 적용시키는 것에 더 흥미와 관심을 느낀다면 엔지니어 쪽에, 논문을 읽고 구현해 보고 더 나은 모델 구조에 대해 연구하는 것에 더 재미가 있다면 리서처에 가까울 것이다. 여기서 내가 했던 실수로는 AI 리서처를 뽑는 자리에서 내 강점으로 빠르게 서비스에 적용하고 피드백을 통해 개선해 나아간다는 소리를 했다..ㅎ   포트폴리오 질문포트폴리오에 관한 질문은 크게 두 가지로 나눌 수 있었다. 첫 번째는 질문을 통해 포트폴리오 내용을 검증하는 방법.두 번째는 내가 제출했던 노션이나 PPT를 보며 프로젝트를 설명하고 질문을 받는 방법. 두 가지 방법 모두 내가 작성한 포트폴리오에 대한 내용을 모두 구체적으로 알고 있고, 자주 물어보는 '어려웠던 점'과 '해결했던 방법'에 대해 확실히 정리하고 가면 어려울 것 없는 질문이다. 기술 영역 질문기술 영역의 핵심은 일단 자신이 이력서에 쓴 모델이나 기술에 대해서는 다 설명할 수 있을 정도로 알고 가야 한다. 예를 들어 내가 받은 질문 중에는 ""xgboost에 대해서 설명할 수 있나요? 위키피디아 수식을 보면서 설명해 주세요.""라는 질문도 있었다. 그 외에 머신러닝, 딥러닝, CS 기초 등등에 대한 질문은 다른 분들이 정리해 놓은 것을 참고하길 바란다. >> (Datascience-Interview-Questions) 마지막 대망의 임원 면접!임원 면접은 두 군데를 봐서 많은 데이터는 없지만 주로 인성과 컬처 핏에 대한 질문을 한다. 그래서 나는 이때 기업에 대한 조사를 많이 해갔다. 그리고 이 기업에서 내가 어떤 일을 하길 원하는지, 한 번쯤 생각해 보고 가는 것도 좋을 것 같다. 실무진 면접에서는 이 사람이 갖고 있는 업무 능력에 대해 판단했다면, 임원 면접에서는 내가 가지는 일에 대한 가치관 혹은 목표 등을 질문한다. 또 나라는 사람이 갖고 있는 장점, 단점 그리고 어떻게 스트레스를 관리하는지 등에 대해서도 고민하고 가면 좋겠다.  면접의 끝 우리한테 궁금한 점 있으세요?면접은 나와 기업이 서로 손잡는 동등한 위치에서 이야기를 나눈다고 생각해야 한다. (물론 면접을 보는 상황 자체는 너무나도 떨리는 일이지만 ㅠㅠ) 지금 이 글을 쓰는 시점에서는 이미 일을 시작하고 있기 때문에 이 점이 더욱 중요하게 느껴진다. 직원은 회사의 상황에 대해서도 이해를 해주며 회사의 성장도 신경을 써야 한다. 그와 동시에 회사도 개인의 성장과 그에 맞는 환경을 제공해 주려 노력해야 한다. 회사의 goal과 개인의 goal이 완벽히 같을 순 없겠지만 최대한 서로에게 필요한 존재가 되기위해서 기업과 직원이 양쪽에서 노력해야 한다.  그런 의미에서 면접에서 마지막 질문은 내가 이 회사에서 얼마나 성장을 할 수 있을지를 엿볼 수 있는 기회이기도 하다. 그러니 궁금한 점 없다고 넘겨버리지 말기! 나 같은 경우엔 Computer Vision에 관심이 있었고 이 분야에서도 성장을 할 수 있는지를 보려고 했다. 직접적으로 저는 CV분야 아니면 안 합니다!라는 뉘앙스가 아니라 진행하는 프로젝트 등의 설명을 들으며 파악해 보라는 것! 질문 예시1. 팀의 규모와 구성은 어떻게 되어있나요?2. 현재 어떤 프로젝트들을 하고 계신가요? 혹은 앞으로 계획된 프로젝트는 어떤 것이 있나요?3. 프로젝트에 대해 궁금한 점이 있다면 더 여쭤보기4. 개발 환경은 어떻게 이루어져 있나요? (gpu 등..) 마치며참.. 구직활동을 하며 다시 한번 일자리 구하기 어렵구나 하는 생각이 많이 든다. 그래도 생각하는 시각을 약간 바꾸어 꾸준히 공부와 동시에 지원서를 제출함으로써 '내가 얼마나 성장했는지'를 지속적으로 평가해 보는 것도 취업 준비를 하는 여정에 지치지 않는 나만의 팁 같다. 가끔은 지원서를 내고 그 결과를 기다리는 기간 동안 복권을 사고 기다리는 것과 비슷하는 감정이 든다. 합격할 확률보다 불합격할 확률이 많더라도 어떤 기대감에 사로잡혀 그 주를 더 열심히 살기도 한다.신입의 입장에서는 내 이력서가 매력적일까?라는 고민이 가장 클 텐데 계속해서 발전해 가며 모두들 원하는 곳에 다 합격하셨으면 좋겠다! 728x90반응형(adsbygoogle = window.adsbygoogle || []).push({});     (adsbygoogle = window.adsbygoogle || []).push({});    if(window.ObserveAdsenseUnfilledState !== undefined){ ObserveAdsenseUnfilledState(); }window.ReactionButtonType = 'reaction';window.ReactionApiUrl = '//day-to-day.tistory.com/reaction';window.ReactionReqBody = {    entryId: 52}공유하기게시글 관리Day to_day저작자표시 비영리 변경금지 'In my mind' 카테고리의 다른 글글또 8기를 마무리하며..  (0)2023.07.15글또 8기를 시작하기 전에..  (0)2023.02.0226년간의 회고  (0)2023.01.14Enter ↵  (0)2022.07.18'In my mind' Related Articles글또 8기를 마무리하며..2023.07.15글또 8기를 시작하기 전에..2023.02.0226년간의 회고2023.01.14Enter ↵2022.07.18more0  Comments댓글쓰기 폼이름비밀번호                                              Secret                                          댓글SendloadedComments[52]=true;findFragmentAndHighlight(52);Blog is powered bykakao / Designed byTistory티스토리툴바Day to_day구독하기hljs.initHighlightingOnLoad();window.roosevelt_params_queue = window.roosevelt_params_queue || [{channel_id: 'dk', channel_label: '{tistory}'}]window.tiara = {""svcDomain"":""user.tistory.com"",""section"":""글뷰"",""trackPage"":""글뷰_보기"",""page"":""글뷰"",""key"":""5467601-52"",""customProps"":{""userId"":""0"",""blogId"":""5467601"",""entryId"":""52"",""role"":""guest"",""trackPage"":""글뷰_보기"",""filterTarget"":false},""entry"":{""entryId"":""52"",""entryTitle"":""신입 머신러닝 엔지니어 / AI 리서처 면접 후기"",""entryType"":""POST"",""categoryName"":""In my mind"",""categoryId"":""1021328"",""serviceCategoryName"":null,""serviceCategoryId"":null,""author"":""5468083"",""authorNickname"":""m_inglet"",""blogNmae"":""Day to_day"",""image"":""kage@7M37e/btsFv0L06Ux/S3rRxOXv1yAhz97E0kS52K"",""plink"":""/52"",""tags"":[]},""kakaoAppKey"":""3e6ddd834b023f24221217e370daed18"",""appUserId"":""null""}"
1,https://mvje.tistory.com/88,에러 메세지,본문 바로가기메뉴 바로가기에러 메세지권한이 없거나 존재하지 않는 페이지입니다.궁금하신 사항은 고객센터로 문의해 주시기 바랍니다.이전화면TISTORY
2,https://jonhyuk0922.tistory.com/218,후기는 개인적인 회고에 가깝습니다!,"진로 탐색 log/과제 기록[진로탐색] ML/DL 분야 과제테스트 및 코딩테스트 후기 1탄 조녁2022. 4. 7. 00:49반응형(adsbygoogle = window.adsbygoogle || []).push({});   안녕하세요~!28년차 진로탐색꾼 조녁입니다! 일전에는 계속해서 진행했던 면접과 관련하여 기록하였는데, 이번에 진로탐색하면서 과제테스트를 많이 진행하다보니 제 스스로 제가 본 과제들에 대한 회고를 적고 싶어서,  과제테스트와 AI분야 코딩테스트에 대한 진로탐색 일기를 적어볼까합니다! (반성일기입니다 흑흑) 받은 과제 : 리플에이아이(코딩테스트, 복합어 추출 과제, 당뇨예측 과제), 보이스루(코테), 클래스101(코테), 원티드랩(사전면접)  후기는 개인적인 회고에 가깝습니다!1. 리플에이아이 머신러닝 엔지니어 : 코딩테스트와 과제테스트를 동시에 보내준다(프로그래머스 진행). 최근에 딥러닝을 쓰지 않아도 되면 안쓰는게 낫다는 생각이 있어서 안쓰고 풀었더니 다시 딥러닝으로 풀라고 과제테스트를 다시 보내주셨다. - 느낀점 : 복합어 추출 과제를 풀면서, 한국어와는 다른 영어의 특징을 고민해볼 수 있었다. 그리고 당뇨예측 과제를 풀면서, 내가 NLP쪽만 해서 이런 데이터는 오히려 낯설구나 .. 다양한 도메인에 익숙해져야겠다는 생각을 했다. 코딩테스트는 무난한 난이도였는데 너무 오랜만에 풀어서 버벅이다가 제대로 못푼 느낌이 있었다. 근데도 과제테스트를 다시하라고 보내주신거 보면, 이 회사에는 코딩테스트는 중요하지 않은 것 같다. - 배운점1. Pytorch로 시계열이나 이미지, 추천시스템 등 익숙치 않은 분야에 대해서 튜토리얼 정도 돌려봐도 좋을 것 같다는 생각이 들었다.2. 영어에서 복합명사를 나누는 모듈들을 사용해봤고, 룰베이스 기반으로 점수를 올려볼 수 있었다. 3. (자아성찰) 이번 시즌 첫 코딩테스트를 보며, 코딩테스트 준비가 필요하다는 사실을 꺠달았다.  2. 보이스루 DL Researcher : 코딩테스트 3문제 & 150분(프로그래머스 진행), 일주일의 시간을 주셨는데 다른 과제와 겹쳐서 1회 기간 연장함(1회까지 가능) - 느낀점 : 이메일에 '간단한 실력확인을 위함'이라고 쓰여있긴 했는데 진짜 근래 본 코딩테스트 중에 가장 쉬웠다. 다만 시간 조절을 잘 못해서 마감 25분전에 코테를 시작해서 3문제 중에 1문제는 끝까지 풀진 못했다.. 그런데 왠지 모르지만 붙었다. 정말 아예 못풀지만 않으면 보이스루는 면접에서 터실(?) 예정이신 것 같다 ㅎㅎ.. - 배운점1. NLP를 주로 하는 AI회사들은 코딩테스트가 대체로 쉽고, 텍스트 및 스트링 처리 관련된 게 많은 것 같다.2. (자아칭찬) 내가 코딩테스트를 아예 손도 못대지는 않는구나!!   3. 클래스101 Data Scientist : 코딩테스트 2문제 & 8분(코딜리티 진행) , 데싸와 관련된 코딩테스트 였다. 전부 영어임 - 느낀점 : 첫번째 문제는 몇개의 점들이 주어지고 ROC 커브의 AUPRC를 오차범위 내에서 계산해내는 식이었고 코딩보단 수식 작성에 가까웠다. 첫번째 문제 풀고 얕잡아보고 설렁설렁 했는데 두번째 문제는 precision , recall, f1-score, weighted f1 을 numpy, pandas , sklearn을 활용해서 구현하는 문제였다. 이것도 평가지표들의 수식을 먼저 이해하고 구현하면되는 문제였는데 설렁설렁(중간에 밥먹고옴..) 풀다가 시간 부족해서 다 못풀고 냈다. 사실 문제들이 쉽게 나와서 다 못풀면 끝이구나 싶었는데 진짜 끝이었다는 이야기로 끝. - 배운점1. 코딩테스트 시간에는 집중할 수 있는 환경을 만들고 코딩테스트에 집중하자! 그래야 아쉬움이 남지 않는다.2. sklearn, numpy , pandas에 더 친숙해질 필요가 있다. (이번에 조금 더 친해졌을 지도? ..)  4. 원티드랩 AI Researcher : 사전면접 질문 7가지 & 30분 (Interview Me 진행) , 조금.. 음.. 민망하다! (AI면접 기술면접 버전임) - 느낀점 : 원티드랩에서 서비스하는 인터뷰 미라는 툴은 면접을 연습하기 위한 도구고, 언제든 사용할 수 있는 것 처럼 보였다. 30분안에 한큐로 촬영해야하지만, 하다가 말고 다시 촬영해도 된다. 즉, 질문 7개는 오픈되어있기 때문에 다 검색해보고 공부해서 봐도 된다. 다만, 한큐에 촬영해야한다는게 포인트다. 중간에 틀렸다면 처음부터 다시해야한다 ㅎㅎ.. 그래서 나는 그냥 한번에 찍고 끝냈다. 질문들은 아래와 같고 그렇게 어려운 질문은 없으나 한번에 술술 이야기하는 게 쉽지않은.. 마치 AI면접 기술면접 버전처럼 느껴졌다. 그래도 좋은 서비스 알게되서 앞으로 면접전에 이걸로 연습해봐야겠다!  - 배운점1. 좋은 면접 연습 도구인 ""Interview Me""를 알게 되었다. (광고 아님)2. 비지도 학습은 패턴이나 군집을 학습하는 구나. 내가 했던 공부들이 이 질문에 답이 되는 것들이었구나! - 질문 목록 1. Supervised learning과 Unsupervised learning의 Objective fuction과 그 차이를 딥러닝 모델 중심으로 설명해 주세요2. 딥러닝 모델의 과적합을 방지하기 위해서 어떤 방법들을 사용하는지 설명해 주세요3. RNN 기반의 LM과 Transformer 계열의 LM의 가장 큰 차이점은?4. 분포가 불균형한 비정형 데이터를 분류 할 때 발생하는 문제는 무엇인가요? 해결법은?5. Domain Knowledge가 머신 러닝 모델에 미치는 영향에 대해 프로젝트 경험을 중심으로 설명해주세요6. 머신러닝 모델을 활용해서 문제를 해결하려고 할 때 가장 중요하게 생각하는 것은 어떤 것인가요?7. 최근 가장 인상적으로 읽은 논문은 무엇인가요? https://link.coupang.com/a/rGNhA [한빛미디어]이것이 취업을 위한 코딩 테스트다 with 파이썬COUPANGwww.coupang.com""이 포스팅은 쿠팡 파트너스 활동의 일환으로, 이에 따른 일정액의 수수료를 제공받습니다.""반응형(adsbygoogle = window.adsbygoogle || []).push({});     (adsbygoogle = window.adsbygoogle || []).push({});    if(window.ObserveAdsenseUnfilledState !== undefined){ ObserveAdsenseUnfilledState(); }window.ReactionButtonType = 'reaction';window.ReactionApiUrl = '//jonhyuk0922.tistory.com/reaction';window.ReactionReqBody = {    entryId: 218}공유하기게시글 관리조녁 코딩일기저작자표시 태그과제테스트, 리플에이아이, 보이스루, 원티드랩, 코딩테스트, 클래스101, 후기    setInitialEntryComments(218, 1723768794)Secret댓글달기loadedComments[218]=true;findFragmentAndHighlight(218);"
3,https://dopilog.tistory.com/6,티스토리툴바,"배움/데이터[30대 개발자] 머신러닝 엔지니어/사이언티스트 인터뷰 - 1 도피로그2023. 1. 10. 23:33나는 딥러닝 엔지니어 인턴을 시작으로, 데이터 사이언티스트를 거쳐, 지금은 머신러닝 엔지니어로 일하고 있다. 나는 AI/ML 관련 직책으로 다양한 회사에 지원했었고, 그중 특히 머신러닝 엔지니어 포지션의 인터뷰는 정말 그 방식이 다양했다. 어떤 회사는 일주일이라는 시간과 회사 내부 데이터를 주고 모델을 만들고 분석해 오라는 과제를 주기도 했고, 텅 빈 Jupyter Notebook 위에 feature analysis, engineering, model training/evaluation까지 1시간 내에 마쳐보라고 하는 회사도 있었다. 또 다른 날은 팀의 매니저와 두 시간 동안 확률과 점화식 문제를 풀었어야 했을 때도 있었다. 소프트웨어 엔지니어와 달리 머신러닝 엔지니어는 인터뷰 과정에서 다양한 지식을 검증받는다. 코딩은 물론 기초 확률/통계와 머신러닝 개념에 대한 전반적인 이해도를 검증받는다. 머신러닝 엔지니어가 되기 위해선 코딩 인터뷰를 비롯해 정말 다양한 분야를 리뷰해야 했고, 나는 다음과 같은 방법으로 인터뷰를 준비했다. 1. KaggleKaggle에 올라온 수 많은 사람들이 작성한 Jupyter Notebook script 들을 참고해 보자. 짧은 시간 내에 사람들이 일반적으로 데이터 분석 및 모델링을 어떻게 하는지 파악할 수 있을 것이다. 이를 바탕으로 나만의 script를 작성해보자. 이 script를 바탕으로 차근차근 데이터를 분석하고 모델링 하면 인터뷰를 잘 마칠 수 있을 것이다. 2. 확률통계 & 머신러닝면접관은 때때로 면접 직전 warm up question으로 기초 개념들을 물어본다. 이때 간결하게 질문에 답변할 수 있기 위해선 예전에 공부했던 강의 자료를 반복 학습하고 학습한 내용을 이해하고 있는 게 중요하다. 대학에서, 혹은 독학한 공부 자료가 있다면 복습해 보자. 개인적으로 스탠퍼드 대학의 CS229 강의 자료가 인터뷰 준비하면서 정말 많은 도움이 됐고, 추가적으로 precision/recall 과 같은 evalation metrics에 대해서 깊게 학습한 게 도움이 됐다.  3. 머신러닝 시스템 디자인스탠퍼드 대학의 CS329S 강의를 정독해 보자. 현업에서 머신러닝 시스템을 어떻게 구성하는지 많은 케이스스터디와 그들의 솔루션을 배울 수 있다.반응형(adsbygoogle = window.adsbygoogle || []).push({});     (adsbygoogle = window.adsbygoogle || []).push({});    if(window.ObserveAdsenseUnfilledState !== undefined){ ObserveAdsenseUnfilledState(); }window.ReactionButtonType = 'reaction';window.ReactionApiUrl = '//dopilog.tistory.com/reaction';window.ReactionReqBody = {    entryId: 6}공유하기게시글 관리도피로그 Secret댓글댓글달기loadedComments[6]=true;findFragmentAndHighlight(6);"
4,https://dipndeep.tistory.com/m/15,머신러닝 엔지니어 기술면접 후기,"카테고리 없음머신러닝 엔지니어 기술면접 후기DeepinDev 2021. 7. 27. 18:31 머신러닝 응용 엔지니어 포지션으로 지원한 원티드랩과의 기술 면접이 있었다. 내가 잘 아는 것이 나왔다면 좋았겠지만 반은 그렇고 반은 그렇지 못했다. 면접에서 내가 스스로 만족했던 부분과 그렇지 못했던 부분을 정리하며 이 포스팅을 마치고자 한다. 1. 내가 좋아하는게 뭔지 확실히 전달하였다. 커리어를 포함해서 나는 어떤 방향으로 성장하고 싶은지에 대해 물어봐주셨고, 내가 가진 목표나 지향점을 확실하게 어필할 수 있었다. 개인적으로 리서치를 하는 연구원보다는 머신러닝을 전반적으로 서비스 하는 경험을 높게 보는데, 이런 점을 충분히 키워나갈 수 있는 곳에서 일하고 싶다는 의지를 표현했다.  개인적으로 프론트엔드를 좋아한다는 말도 덧붙였다. 왜냐하면 웹서비스에서 중요한 부분은 여러가지가 있지만 프론트엔드에서 대부분의 요청을 처리하고 이를 통해서 Rest API를 설계하는 방향도 있기 때문에, 그리고 개발을 시작하고 프로젝트를 완성한 경험이 Javascript를 활용한 것이었기 때문에, 그렇게 이야기 한것 같다.  2. 자연어 처리에 있어서 딥러닝에 대한 이해도가 부족하였다. 과제의 문제를 해결한 방법에서 내가 활용하지 않은 부분이 딥러닝 모델이었다. 그 이유는 데이터가 충분하지 않았고 ( 반대로 적은 데이터에서 머신러닝 모델이 유효하다고 생각하였다. ) 이런 부분을 단적으로 해결할 방법이 마땅치 않았기 때문이었다. 면접에서는 개선을 위한 방법으로 딥러닝을 활용한다고 하였는데, 충분히 고민하고 알지 못하는 상황에서 딥러닝 모델을 활용한다고 하였기 때문에 충분히 이해가 되는 답변을 내놓지 못했다.  딥러닝 자연어처리에서 Transformer는 어떤건지, RNN은 어떤건지, Attention 메커니즘은 어떤건지 에 대한 답변을 정확하게 못했다. 지금 열려있는 Edwith 강의를 충분히 활용하고 실습하면서 내가 이해하는 자연어처리를 발전시켜나가는 것이 이 면접에서 얻을 수 있는 것이라고 생각된다. 이 면접이 앞으로 다가올 면접들에 대해 충분히 생각하며 발전할 수 있는 기회가 되길! "
